<?xml version="1.0" encoding="UTF-8"?>
<!DOCTYPE MoviesionData SYSTEM "MoviesionData.dtd">
<MoviesionData>
    <Movie Id="M1" DirectorId="D1">
        <Title>Inception</Title>
        <Genre>Mystery</Genre>
        <RunningTime>148</RunningTime>
        <ReleaseDate>2010-07-08</ReleaseDate>
    </Movie>
    <Movie Id="M2" DirectorId="D2">
        <Title>Avatar</Title>
        <Genre>Mystery</Genre>
        <RunningTime>161</RunningTime>
        <ReleaseDate>2009-12-10</ReleaseDate>
    </Movie>
    <Director Id="D1">
        <FirstName>Christopher</FirstName>
		<LastName>Nolan</LastName>
        <DateOfBirth>1970-06-30</DateOfBirth>
        <PlaceOfBirth>England</PlaceOfBirth>
    </Director>
    <Director Id="D2">
        <FirstName>James</FirstName>
		<LastName>Cameron</LastName>
        <DateOfBirth>1954-08-16</DateOfBirth>
        <PlaceOfBirth>Canada</PlaceOfBirth>
    </Director>
</MoviesionData>
